{
  "id": "weibo-hot",
  "title": "微博热搜",
  "logo": null,
  "screenshots": ["assets/screenshot.png"],
  "platforms": ["macos", "windows", "linux"],
  "size": { "width": 360, "height": 340 },
  "dragMode": "all",
  "permissions": ["script"],
  "network": ["https://weibo.com", "https://s.weibo.com"]
}
